{
  "$schema": "https://json-schema.org/draft/2020-12/schema",
  "$id": "https://bw-brain.local/schemas/profile.schema.json",
  "title": "Profile",
  "description": "ARCH-01 genre-profile contract. A declarative JSON config of constants + a small fixed set of OPTIONAL override hooks (designed, exercised only when a real genre-specific constraint emerges — D-13). Used by the daemon profile loader (Plan 03). Source: CONTEXT.md D-13/D-14 + RESEARCH.md §Code Examples 'profile JSON shape'.",
  "$comment": "ARCH-01/02 contract. Source-of-truth decisions: D-13 (profile = data + optional hooks — electronic/techno v1 ships JSON-only so the hook contract is exercised only when a real need emerges), D-14 (generic default, techno opted-in — the daemon ships a STRICT generic core with hardcoded neutral defaults; electronic/techno is a SEPARATE profile the producer OPTS INTO via intent.json). Profile-absent → generic core runs LITERALLY (INV-13).",
  "type": "object",
  "required": ["name", "thresholds"],
  "additionalProperties": false,
  "properties": {
    "name": {
      "type": "string",
      "minLength": 1,
      "description": "Profile identifier. 'generic' is the strict neutral default (D-14); 'techno' is the first opt-in profile."
    },
    "extends": {
      "type": "string",
      "minLength": 1,
      "description": "Optional parent profile name. The loader deep-merges over the parent (thresholds/curves/scales/roleSalience). 'techno' extends 'generic'."
    },
    "thresholds": {
      "type": "object",
      "required": ["vary", "counterline", "voiceLeadingFix", "humanize"],
      "additionalProperties": false,
      "description": "Motif-similarity thresholds per transform type. Creative transforms (vary/counterline) refuse below threshold (D-08); cleanup transforms (voiceLeadingFix/humanize) skip the motif gate (D-10 → 0.0).",
      "properties": {
        "vary": { "type": "number", "minimum": 0, "maximum": 1 },
        "counterline": { "type": "number", "minimum": 0, "maximum": 1 },
        "voiceLeadingFix": { "type": "number", "minimum": 0, "maximum": 1 },
        "humanize": { "type": "number", "minimum": 0, "maximum": 1 }
      }
    },
    "velocityHumanize": {
      "type": "object",
      "required": ["jitter", "curve"],
      "additionalProperties": false,
      "description": "MIDI-05 velocity humanize parameters. jitter = ±N velocity (gaussian); curve shapes the distribution.",
      "properties": {
        "jitter": { "type": "number", "minimum": 0 },
        "curve": { "enum": ["gaussian", "uniform"] }
      }
    },
    "timingHumanize": {
      "type": "object",
      "required": ["jitterBeats"],
      "additionalProperties": false,
      "description": "MIDI-05 timing humanize parameters. jitterBeats = ±N beats (gaussian).",
      "properties": {
        "jitterBeats": { "type": "number", "minimum": 0 }
      }
    },
    "roleSalience": {
      "type": "object",
      "additionalProperties": { "type": "number", "minimum": 0, "maximum": 1 },
      "description": "Track role → motif-salience weight. 'kick', 'bass', 'lead', 'pad', 'hats', 'percussion', 'fx' are the conventional keys; the open map allows profile-specific extensions."
    },
    "preferredScales": {
      "type": "array",
      "items": { "type": "string", "minLength": 1 },
      "description": "Scale/mode names preferred for the inferred-harmony fallback (D-12). tonal Scale.get() consumes these. Generic prefers [minor, dorian, phrygian]; techno prefers [minor, phrygian, locrian]."
    },
    "strongBeatGrid": {
      "type": "array",
      "items": { "type": "number" },
      "description": "Beat positions within a 4/4 bar that count as 'strong' (counterline target, vary anchor). Generic: [0,1,2,3] (every beat); techno: [0,2] (4-on-the-floor)."
    },
    "energyWeights": {
      "type": "object",
      "additionalProperties": false,
      "required": ["noteDensity", "velocityAggregate", "polyphony", "pitchCentroid"],
      "description": "D-05 energy-curve composite weights. The four weights MUST sum to 1.0 (validated at load by the daemon — Ajv 2020-12 has no native sum constraint, so the loader emits a warning when the sum deviates > 0.01 from 1.0; ARCH-02 'enhance never gate' — the loader logs but never throws).",
      "$comment": "ARCH-02: this field is OPTIONAL — generic core runs literally without it. Analyzers gate on field-presence (ctx.profile.energyWeights ?? defaultWeights).",
      "properties": {
        "noteDensity": { "type": "number", "minimum": 0, "maximum": 1 },
        "velocityAggregate": { "type": "number", "minimum": 0, "maximum": 1 },
        "polyphony": { "type": "number", "minimum": 0, "maximum": 1 },
        "pitchCentroid": { "type": "number", "minimum": 0, "maximum": 1 }
      }
    },
    "sectionLabels": {
      "type": "array",
      "items": {
        "type": "object",
        "additionalProperties": false,
        "required": ["label", "position", "energyRange"],
        "properties": {
          "label": { "type": "string", "minLength": 1 },
          "position": { "enum": ["start", "middle", "end", "any"] },
          "energyRange": {
            "type": "array",
            "items": { "type": "number" },
            "minItems": 2,
            "maxItems": 2
          }
        }
      },
      "description": "D-07 vocabulary for section labeling. Generic ships [intro, build, peak, breakdown, outro]; techno REPLACES with [drop, break, roll]. Position+energy heuristics map a detected cluster to a label."
    },
    "roleTemplates": {
      "type": "array",
      "items": {
        "type": "object",
        "additionalProperties": false,
        "required": ["role", "registerLow", "registerHigh", "rhythmProfile", "velocityProfile"],
        "properties": {
          "role": { "type": "string", "minLength": 1 },
          "registerLow": { "type": "number", "minimum": 0, "maximum": 127 },
          "registerHigh": { "type": "number", "minimum": 0, "maximum": 127 },
          "rhythmProfile": {
            "type": "array",
            "items": { "type": "number" },
            "minItems": 5,
            "maxItems": 5
          },
          "velocityProfile": {
            "type": "object",
            "additionalProperties": false,
            "required": ["mean", "variance"],
            "properties": {
              "mean": { "type": "number", "minimum": 0, "maximum": 1 },
              "variance": { "type": "number", "minimum": 0 }
            }
          },
          "minConfidence": { "type": "number", "minimum": 0, "maximum": 1, "default": 0.5 }
        }
      },
      "description": "D-08 track-role templates. Generic ships 7 (kick/bass/lead/pad/hats/percussion/fx); techno REPLACES with 2 (tighter kick/bass register windows — array-replace, not append)."
    }
  }
}
